{
  "audit": {
    "all_stages_temporally_realized": true,
    "atomic_leg_count": 1,
    "boundary_signatures_compatible": true,
    "carrier_chain_valid": true,
    "distinct_endpoints": true,
    "ends_target_only": true,
    "event_graph_well_formed": true,
    "every_adjacent_stage_operationally_linked": true,
    "every_atomic_leg_valid": true,
    "failed_obligations": [],
    "forbidden_verdict_fields_absent": true,
    "frontier_cover_valid": true,
    "leg_audits": [
      {
        "atomic_leg_valid": true,
        "audit_later_stage": 2,
        "end_stage": 2,
        "failed_obligations": [],
        "leg_id": "leg-S-M",
        "mixed_stage": 1,
        "route_status": "route-indexed",
        "source_carrier": 17,
        "source_nonredundant": true,
        "start_stage": 0,
        "takeover_stage": 2,
        "target_carrier": 55,
        "target_nonredundant": true
      }
    ],
    "leg_count_matches_chain": true,
    "local_temporal_steps_valid": true,
    "mixed_stage_count": 1,
    "route_discipline_valid": true,
    "route_status": "route-indexed",
    "stage_indices_contiguous": true,
    "stages_well_formed": true,
    "starts_source_only": true,
    "strict_corridor_valid": true,
    "support_nonempty_and_unique": true
  },
  "certificate_id": "COR-POS-02A",
  "checker": {
    "checked_at_phase": "CST-TT-04",
    "function": "audit_strict_corridor",
    "module": "cst_tt.corridor",
    "python_version": "3.13.5"
  },
  "claim_ceiling": "exact finite structural temporal-lineage criterion only",
  "claim_lanes": [
    "S-L"
  ],
  "model_ref": "models/corridors/COR-POS-02A.model.json",
  "model_sha256": "6a162e3005a78178e4790efe381ebd848b733b388f6c0207081b8cd221b96aa8",
  "result_status": "checked-finite-strict-temporal-corridor",
  "schema_version": "CST-TT-04",
  "theorem_evidence": {
    "lean_compile_status": "pending-toolchain",
    "lean_declarations": [
      "CSTTT.CorridorTheory.atomicTemporalCorridorCertificateSound",
      "CSTTT.CorridorTheory.strictTemporalCorridorComposition",
      "CSTTT.CorridorTheory.noMixedStageExcludesAtomicCorridor",
      "CSTTT.CorridorTheory.realizedGapExcludesAtomicCorridor"
    ],
    "theorem_ids": [
      "TTH-04",
      "TTN-01",
      "TTN-09"
    ]
  }
}
